{"coverage":{"from":"1990-01","to":"2026-10","transactions":989703},"last_refresh":"2026-10-25T13:33:57.223189+00:00","priced_for":"2026-11","model":{"version":"2026-10","trained_on":"2026-10-26","data_window":{"train_from":"2015-01-01","train_end":"2023-12","valid_end":"2024-12","fit_end":"2024-12","last_month":"2026-10"},"test":{"sales":46518,"mae":29176,"mape":0.0443,"r2":0.96,"interval_80_coverage":0.7956}},"towns":[{"town":"ANG MO KIO","file":"recent/ang-mo-kio.json"},{"town":"BEDOK","file":"recent/bedok.json"},{"town":"BISHAN","file":"recent/bishan.json"},{"town":"BUKIT BATOK","file":"recent/bukit-batok.json"},{"town":"BUKIT MERAH","file":"recent/bukit-merah.json"},{"town":"BUKIT PANJANG","file":"recent/bukit-panjang.json"},{"town":"BUKIT TIMAH","file":"recent/bukit-timah.json"},{"town":"CENTRAL AREA","file":"recent/central-area.json"},{"town":"CHOA CHU KANG","file":"recent/choa-chu-kang.json"},{"town":"CLEMENTI","file":"recent/clementi.json"},{"town":"GEYLANG","file":"recent/geylang.json"},{"town":"HOUGANG","file":"recent/hougang.json"},{"town":"JURONG EAST","file":"recent/jurong-east.json"},{"town":"JURONG WEST","file":"recent/jurong-west.json"},{"town":"KALLANG/WHAMPOA","file":"recent/kallang-whampoa.json"},{"town":"MARINE PARADE","file":"recent/marine-parade.json"},{"town":"PASIR RIS","file":"recent/pasir-ris.json"},{"town":"PUNGGOL","file":"recent/punggol.json"},{"town":"QUEENSTOWN","file":"recent/queenstown.json"},{"town":"SEMBAWANG","file":"recent/sembawang.json"},{"town":"SENGKANG","file":"recent/sengkang.json"},{"town":"SERANGOON","file":"recent/serangoon.json"},{"town":"TAMPINES","file":"recent/tampines.json"},{"town":"TOA PAYOH","file":"recent/toa-payoh.json"},{"town":"WOODLANDS","file":"recent/woodlands.json"},{"town":"YISHUN","file":"recent/yishun.json"}],"sources":[{"source":"hawker_centres","dataset_id":"d_4a086da0a5553be1d89383cd90d07ecd","name":"Hawker Centres (GEOJSON)","url":"https://data.gov.sg/datasets/d_4a086da0a5553be1d89383cd90d07ecd/view","last_updated":"2026-10-25T10:06:44+08:00","retrieved":"2026-10-25T13:33:44.614842+00:00"},{"source":"hdb_block_info","dataset_id":"d_17f5382f26140b1fdae0ba2ef6239d2f","name":"HDB Property Information","url":"https://data.gov.sg/datasets/d_17f5382f26140b1fdae0ba2ef6239d2f/view","last_updated":"2026-10-08T10:40:09+08:00","retrieved":"2026-10-25T13:32:59.785822+00:00"},{"source":"hdb_resale","dataset_id":"d_2d5ff9ea31397b66239f245f57751537","name":"Resale Flat Prices (Based on Registration Date), From Mar 2012 to Dec 2014","url":"https://data.gov.sg/datasets/d_2d5ff9ea31397b66239f245f57751537/view","last_updated":"2024-08-28T13:56:45+08:00","retrieved":"2026-10-25T13:32:05.570107+00:00"},{"source":"hdb_resale","dataset_id":"d_43f493c6c50d54243cc1eab0df142d6a","name":"Resale Flat Prices (Based on Approval Date), 2000 - Feb 2012","url":"https://data.gov.sg/datasets/d_43f493c6c50d54243cc1eab0df142d6a/view","last_updated":"2024-08-28T14:06:52+08:00","retrieved":"2026-10-25T13:32:01.188424+00:00"},{"source":"hdb_resale","dataset_id":"d_8b84c4ee58e3cfc0ece0d773c8ca6abc","name":"Resale flat prices based on registration date from Jan-2017 onwards","url":"https://data.gov.sg/datasets/d_8b84c4ee58e3cfc0ece0d773c8ca6abc/view","last_updated":"2026-10-25T02:10:18+08:00","retrieved":"2026-10-25T13:31:48.374191+00:00"},{"source":"hdb_resale","dataset_id":"d_ea9ed51da2787afaf8e51f827c304208","name":"Resale Flat Prices (Based on Registration Date), From Jan 2015 to Dec 2016","url":"https://data.gov.sg/datasets/d_ea9ed51da2787afaf8e51f827c304208/view","last_updated":"2024-08-28T13:41:10+08:00","retrieved":"2026-10-25T13:32:28.674682+00:00"},{"source":"hdb_resale","dataset_id":"d_ebc5ab87086db484f88045b47411ebc5","name":"Resale Flat Prices (Based on Approval Date), 1990 - 1999","url":"https://data.gov.sg/datasets/d_ebc5ab87086db484f88045b47411ebc5/view","last_updated":"2024-08-28T14:26:27+08:00","retrieved":"2026-10-25T13:32:22.985676+00:00"},{"source":"mrt_exits","dataset_id":"d_b39d3a0871985372d7e1637193335da5","name":"LTA MRT Station Exit (GEOJSON)","url":"https://data.gov.sg/datasets/d_b39d3a0871985372d7e1637193335da5/view","last_updated":"2026-10-18T10:06:43+08:00","retrieved":"2026-10-25T13:32:46.951330+00:00"},{"source":"parks","dataset_id":"d_77d7ec97be83d44f61b85454f844382f","name":"NParks Parks and Nature Reserves","url":"https://data.gov.sg/datasets/d_77d7ec97be83d44f61b85454f844382f/view","last_updated":"2026-10-25T10:06:45+08:00","retrieved":"2026-10-25T13:33:48.212971+00:00"},{"source":"planning_areas","dataset_id":"d_4765db0e87b9c86336792efe8a1f7a66","name":"Master Plan 2019 Planning Area Boundary (No Sea)","url":"https://data.gov.sg/datasets/d_4765db0e87b9c86336792efe8a1f7a66/view","last_updated":"2025-12-05T10:07:55+08:00","retrieved":"2026-10-25T13:32:48.900082+00:00"},{"source":"resale_price_index","dataset_id":"d_14f63e595975691e7c24a27ae4c07c79","name":"HDB Resale Price Index (1Q2009 = 100), Quarterly","url":"https://data.gov.sg/datasets/d_14f63e595975691e7c24a27ae4c07c79/view","last_updated":"2026-07-24T11:36:15+08:00","retrieved":"2026-10-25T13:33:57.223189+00:00"},{"source":"schools","dataset_id":"d_688b934f82c1059ed0a6993d2a829089","name":"General information of schools","url":"https://data.gov.sg/datasets/d_688b934f82c1059ed0a6993d2a829089/view","last_updated":"2026-04-17T15:05:04+08:00","retrieved":"2026-10-25T13:33:26.703983+00:00"}],"licence":{"name":"Singapore Open Data Licence version 1.0","url":"https://data.gov.sg/open-data-licence"},"geocoder":{"name":"OneMap search API","url":"https://www.onemap.gov.sg/apidocs/"},"disclaimer":"Indicative only: statistical estimates from past resales, not valuations."}